{
  "task_id": "TASK-002",
  "title": "Persist Recent Confirmation Window as a first-class AOF artifact",
  "description": "The Value Alignment Loop and state ownership model both rely on a Recent Confirmation Window, but the AOF repo does not yet have a canonical artifact or write path for storing that memory.",
  "status": "done",
  "origin": "orchestrator",
  "orchestrator_session_id": null,
  "assigned_session_ids": [],
  "related_decision_record_id": null,
  "operating_goal_ref": "aof-self-hosting-cycle-001",
  "created_at": "2026-06-03T11:30:00+09:00",
  "updated_at": "2026-06-02T16:07:46.806Z",
  "assigned_at": null,
  "done_at": "2026-06-02T16:07:46.806Z",
  "retired_at": null,
  "last_triaged_at": "2026-06-03T11:30:00+09:00",
  "triage_notes": "Closed by confirmation window write-path slice"
}
