{
  "task_id": "TASK-001",
  "title": "Add minimal runtime write path for .aof/tasks and .aof/goals",
  "description": "The v1.8 docs and schemas define AOF-native task memory and goal projection, but the current runtime does not yet provide a canonical write path for these structures in the AOF repo itself.",
  "status": "archived",
  "origin": "orchestrator",
  "orchestrator_session_id": null,
  "assigned_session_ids": [],
  "related_decision_record_id": null,
  "operating_goal_ref": "v1.8-gate-6-self-audit",
  "created_at": "2026-06-02T23:59:00+09:00",
  "updated_at": "2026-06-02T15:33:42.912Z",
  "assigned_at": null,
  "done_at": "2026-06-02T15:33:27.226Z",
  "retired_at": null,
  "last_triaged_at": "2026-06-03T11:30:00+09:00",
  "triage_notes": "Archived after done-state check"
}
